Headline,Genre
"Despite Punjab, HP, Delhi defeats, BJP gets ready for 2024 riding on G20",Politics
Nitish Kumar 'Jo Piyega Wo Marega' may come back to haunt him,Politics
Satish Chandra Mishra: Has BSP pushed Mayawati’s man Friday to the margin?,Politics
Mainpuri bypoll: Will chacha-bhatija's 'newfound bonhomie' survive test of time?,Politics
Line of No Control,Politics
Heart of Diplomacy,Politics
This road rage is really spreading,Politics
China's Xi JInping,Politics
TIPRA Motha chief meets Congress leaders as BJP eyes pact,Politics
"LS polls: 'Ahmed Patel's legacy won't go in vain,' Mumtaz says after Cong announces to give late father's seat to AAP",Politics
"Buzz over Navjot Singh Sidhu's return to BJP, Gurdaspur ticket for Yuvraj Singh",Politics
"Victory of voters: Sharad Pawar after Supreme Court ruling on his faction's name, symbol",Politics
"NCP row: Sharad faction can use 'NCP-Sharadchandra Pawar' name till further orders, SC says",Politics
Jharkhand MLAs land in Hyderabad for 'safekeeping' till floor test,Politics
"' A little pressure and he takes U-turn, we don't need him': Rahul Gandhi takes dig at Nitish Kumar",Politics
Why Nitish Kumar's alliance with BJP may help JD(U) in Lok Sabha elections,Politics
Congress vs regional parties in INDIA bloc: Nitish Kumar becomes first leader to walk out of opposition alliance,Politics
"INDIA bloc failed my expectations, Nitish Kumar says after resigning as Bihar CM: Latest developments",Politics
'Thank you Tejashwi': RJD puts out ads in Bihar newspapers amid ongoing political crisis,Politics
"BJP as partner, Nitish Kumar may take oath as CM for record 9th time",Politics
"Nitish's imminent exit, Congress-TMC deadlock leave INDIA gasping",Politics
Bihar CM Nitish Kumar could be back in NDA fold by Monday,Politics
"'Nitish Kumar set to dump RJD, may take oath as Bihar chief minister again next week with BJP's support'",Politics
"Bihar CM Nitish Kumar hits out at UPA governments & dynastic politics, praises PM Narendra Modi",Politics
"'If possible, BSP can ... ': Mayawati rules out pre-poll alliance for 2024 Lok Sabha elections",Politics
No rest for Maharashtra Speaker as January 31 deadline for NCP case looms,Politics
"Sena row: Possible some Maharashtra MLAs from both sides may get disqualified or none at all, legal experts say",Politics
"Now, Nitish Kumar's JD(U) flexes muscles, says will not talk to Congress on seat sharing in Bihar",Politics
Congress puts seat talks with allies on fast track,Politics
"Adhir Ranjan Chowdhury fumes at 2-seat offer, TMC hits back",Politics
"Often, you wait for coronation and get exiled, says Shivraj Singh Chouhan",Politics
'Prime minister of ideas': JD(U)'s message to INDIA bloc after Nitish Kumar returns as party chief,Politics
2024 Lok Sabha elections: Why road ahead for INDIA bloc could be bumpy,Politics
Rahul Gandhi raises caste census pitch again: Will it help Congress in 2024 Lok Sabha elections?,Politics
Ram Mandir inauguration: Congress leader Sam Pitroda says 'don't mix religion with politics'; BJP accuses grand old party of appeasement politics,Politics
"'Cannot fool Indians': BJP makes light of Rahul Gandhi's 'nyay yatra', cites PM Modi's 'real nyay'",Politics
"Looking for headstart, BJP may finalise Lok Sabha tickets early",Politics
Pre-planned strategy from Treasury benches: Priyanka Chaturvedi on suspension of MPs,Politics
Congress take swipe at BJP for not announcing CMs in three states yet,Politics
'BJP will not be able to retain power at Centre if ... ': Mamata Banerjee's message after Congress's defeat in assembly elections,Politics
MP election results: Kamal Nath wilts in face of lotus onslaught,Politics
'Unable to win on its own': Congress faces barbs from allies for ignoring INDIA parties in assembly elections,Politics
"Cash-for-query case: Mamata Banerjee breaks silence, says 'Mahua Moitra's expulsion being planned, but ... '",Politics
"Congress govt in Karnataka 'as good as dead', charges BJP veteran Yediyurappa",Politics
BJP not opposed to caste census but won't make a hasty move: Amit Shah,Politics
2024 Lok Sabha elections: Why Congress strategy with focus on Karnataka could fail,Politics
"'Govt using senior officers for propaganda not right', says Congress chief Mallikarjun Kharge",Politics
Question is about corruption & criminality: BJP MP Nishikant Dubey hits back at Mahua Moitra over degree jab,Politics
"'If Congress behaves like this ... ': Snubbed in Madhya Pradesh, Akhilesh Yadav has a piece of advice for grand old party",Politics
"Alliance trouble for INDIA parties: Akhilesh Yadav upset over snub in MP, warns Congress of same treatment in UP",Politics
JD(S)-BJP alliance: Deve Gowda sacks rebel leader CM Ibrahim as party's Karnataka president; makes his son Kumaraswamy ad-hoc state chief,Politics
'Congress in many ways a family-run party': Shashi Tharoor blunts Rahul Gandhi's 'dynasty' attack on BJP,Politics
Congress chief Kharge alleges Modi govt using Army 'politically' for elections,Politics
CM Shinde is a guest for only a few days: Saamana,Politics
"'Will not go with BJP in Karnataka': Senior JD(S) leader revolts against Deve Gowda's alliance decision, hints at possible split in party",Politics
Corruption is in DNA of Congress: BJP president JP Nadda,Politics
BJP's political power shrinking in many parts of country: Sharad Pawar,Politics
"Farmers in Karnataka have incurred loss of Rs 30,000 crore due to drought: Siddaramaiah",Politics
Bhajan Lal Sharma: An unlikely rise from village sarpanch to Rajasthan CM,Politics
For INDIA alliance to succeed everyone will have to rise above personal 'ambition' for larger good of country: Raghav Chadha,Politics
"Eyeing 350 seats in 2024 Lok Sabha polls, BJP gets into micro-management mode",Politics
"With 4 new state chiefs, BJP tries to change caste equations",Politics
"BJP falls back on Yediyurappa, makes him 'mascot' for Assembly polls",Politics
BJP banks on PM Modi’s charisma to blow the bugle for BMC elections,Politics
"Eye on 2024 elections, BJP identifies 160 Lok Sabha seats for special campaigns",Politics
Assembly polls: Battle of survival for JD(S) or king maker again?,Politics
All you need to know about socialist stalwart Sharad Yadav,Politics
BJP maintained its dominance in 2022 as disjointed Opposition proved no match,Politics
BJP to begin 'Mission 2024' for UP from January,Politics
Nitish Kumar 'Jo Piyega Wo Marega' may come back to haunt him,Politics
"Despite Punjab, HP, Delhi defeats, BJP gets ready for 2024 riding on G20",Politics
Satish Chandra Mishra: Has BSP pushed Mayawati’s man Friday to the margin?,Politics
"Now, Shashi Tharoor is doing a Sachin Pilot in Kerala",Politics
Mainpuri bypoll: Will chacha-bhatija's 'newfound bonhomie' survive test of time?,Politics
"Maharashtra: Undaunted & louder, Sanjay Raut can take Uddhav Thackeray's battle to BJP, Eknath Shinde",Politics
It's bahubali vs bahubali in Mokama bypoll,Politics
"Telangana Munugode bypoll: Stakes high for TRS, BJP, Congress",Politics
"Ticket round over, BJP & Congress now fight identical problem of dissent in Himachal Pradesh",Politics
BJP-BSP in tussle for Muslim votes in Uttar Pradesh,Politics
Amit Shah's visit to Scindia Palace in Gwalior creates buzz in MP political circle,Politics
Visakhapatnam airport emerges as nerve centre of Andhra Pradesh politics,Politics
"The times are challenging, but Congress has to fight: Mallikarjun Kharge",Politics
Telangana: BRS needs ideological glue to make national tag stick,Politics
BJP first to recognise social media as the new electoral battlefield,Politics
Cong a diminishing force in Assam with no bailout in sight,Politics
Why things are falling apart in Congress and centre can't hold,Politics
Real revolt or fixed match? Rajasthan Congress unit keeps all guessing,Politics
UP CM Yogi Adityanath in mission mode with clear goals in sight,Politics
"Non-SP, non-BJP front shaping up in Uttar Pradesh",Politics
‘Operation Lotus’: Punjab politics turns mudslinging match,Politics
First in 45 years: Congress announces election for 12 of 23 CWC posts,Politics
BJP forms strategy to reclaim 15 Uttar Pradesh Lok Sabha seats it lost in 2019,Politics
"BJP eyes bigger Telangana pie, targets win in 10 Lok Sabha seats in 2024",Politics
"TRS president K Chandrasekhar Rao may enter poll fray in Karnataka, Gujarat",Politics
2024 LS polls: BJP begins spadework in Yadav belt,Politics
Yogi’s west UP tours a bid to gauge political situation?,Politics
"Former Karnataka CM BS Yediyurappa’s clout grows, PM Narendra Modi may visit Shivamogga next",Politics
BJP has now netted 93 MLAs from NE parties,Politics
KCR in Bihar to woo Nitish Kumar but yet to endorse him as PM face,Politics
"They question me, but not the one who's fulfilling Modi dream: Ghulam Nabi Azad",Politics
Hemant Soren: From Jharkhand's youngest CM to a seasoned politician,Politics
"Congress a sinking ship, Azad raised valid issues during exit: Maharashtra deputy CM Devendra Fadnavis",Politics
"Exits of Ghulam Nabi Azad, Kapil Sibal leave G-23 change seekers in disarray",Politics
Telangana's self-respect may become poll issue in Munugode,Politics
Cryptic tweet of  Uttar Pradesh deputy CM Keshav Prasad Maurya sets political circles abuzz,Politics
"Maharashtra: Shiv Sena leader Aaditya Thackeray's tours draw crowds, raise concern in BJP camp",Politics
Karnataka: BS Yediyurappa’s comeback a hurdle in Congress bid to woo Lingayats,Politics
How Uttar Pradesh turned a political nursery for BJP to churn out national leaders,Politics
EC chalked out seven-phase polls to assist BJP campaigning: West Bengal CM Mamata Banerjee,Politics
BJP Sikkim manifesto promises protection to rights of Sikkimese people,Politics
"'There must be One Nation, One Election': Rajnath Singh at poll rally in Rajasthan",Politics
"'Congress, RJD have tarnished name of the country': PM Modi in Bihar",Politics
Lok Sabha polls: Congress leader Rahul Gandhi files nomination in Wayanad,Politics
Entire country has faith in PM Modi's guarantee: UP CM Adityanath,Politics
Congress struggles with decision on candidate for Dharwad,Politics
Ajit's NCP slams RSS mag for questioning its entry into NDA,Politics
Taking 'break' for medical reasons: TMC's Abhishek,Politics
MP Akhilesh Yadav quits Karhal assembly seat,Politics
"Andhra, Odisha will usher in record development: PM Modi",Politics
"Wayanad or Rae Bareli, which to quit? My call will make people at both seats happy: Rahul",Politics
Modi cabinet 3.0: 39% ministers have criminal cases against them,Politics
Congress slams PM Modi over Parliamentary Affairs minister pick,Politics
Indian Festivals in 2024,Religion
Lord Vishnu Names,Religion
Heramba Sankashti Chaturthi 2024,Religion
Kajari Teej 2024,Religion
Narali Purnima 2024,Religion
Fifth Sawan Somwar 2024,Religion
Janmashtami 2024,Religion
"Bahula Chaturthi 2024: Date, Time, Rituals and Significance of Bol Chauth",Religion
"Heramba Sankashti Chaturthi 2024: Date, Time, Rituals and Significance of Bhadrapada Sankashti Chaturthi",Religion
"Fifth Sawan Somwar 2024: Date, Rituals and Significance of last Shravan Somwar",Religion
"Narali Purnima 2024: Date, Time, Puja Rituals and Significance",Religion
"Full Moon on August 19, 2024: Step-by-Step Guide to Perform Puja on Shravan Purnima",Religion
"Shravan Purnima 2024: Date, Timings, Puja Rituals and Significance",Religion
"Shravana Putrada Ekadashi 2024: Date, Parana Time, Puja Rituals and Significance",Religion
"Varalakshmi Vratham 2024: Date, Shubh Muhurat, Rituals and Significance",Religion
"When is Shravan Putrada Ekadashi 2024? Date, Rituals and Significance",Religion
"Fourth Mangala Gauri Vrat 2024: Date, Time, Rituals and Significance",Religion
"Fourth Sawan Somwar 2024: Date, Puja Rituals and Significance of Shravan Somwar",Religion
"Skanda Sashti August 2024: Date, Time, Puja Rituals and Significance",Religion
How to please Lord Shiva in Sawan Month?,Religion
"Vinayak Chaturthi August 2024: Date, Puja Muhurat, Rituals and Significance",Religion
"Third Mangala Gauri Vrat 2024: Date, Timings, Puja Rituals and Significance",Religion
"Sawan Somwar 2024: Date, Time, Rituals and Significance of Third Shravan Somwar",Religion
"Aadi Amavasai 2024: Date, Time, Rituals and Significance",Religion
"Amavasya in August 2024: Date, Time, Rituals and Significance",Religion
"Ekadashi in August 2024: Date, Parana Time, Rituals and Significance",Religion
"Sawan Shivratri 2024: Date, Timings, Puja Rituals and Significance",Religion
"Kamika Ekadashi 2024: Date, Parana Time, Rituals, Story and Significance",Religion
"Second Sawan Somwar 2024: Date, Puja Rituals, Mantra and Significance",Religion
"Kamika Ekadashi 2024: When is Kamika Ekadashi? Date, Time, Puja Rituals and Significance",Religion
"Kalashtami July 2024: Date, Time, Puja Rituals and Significance",Religion
"Sawan Shivratri 2024: When is Sawan Shivratri? Know Date, Time and Significance",Religion
Benefits of Worshiping Lord Shiva in Sawan Month,Religion
"Gajanana Sankashti Chaturthi 2024: Date, Puja Time, Rituals and Significance",Religion
10 Things to offer on Shivlinga to seek blessings of Lord Shiva,Religion
"Mangala Gauri Vrat 2024: Date, Puja Rituals, Story and Significance",Religion
Sawan Somwar Vrat Katha and Step by Step Puja Vidhi,Religion
"Satyanarayan Vrat July 2024: Date, Puja Timings, Puja Rituals and Significance of Purnima Vrat",Religion
"Ashadha Purnima 2024: Date, Time, Rituals and Significance of Vyas Purnima",Religion
"Sawan Somwar 2024: Date, Timings, Significance, Fasting Ritual, and Rudrabhishek Guide",Religion
Sawan 2024 Fasting Rules: Do's and Don'ts to follow during Shravan Month,Religion
"Jaya Parvati Vrat 2024: Date, Timings, Puja Rituals and Significance",Religion
"Shukra Pradosh Vrat 2024: Date, Time, Puja Muhurat, Rituals and Significance",Religion
Sawan 2024: Dos and don'ts while fasting during the month of shravan,Religion
Chaturmas 2024 Start and End Date: Rituals and Significance,Religion
Devshayani Ekadashi Parana 2024: Rituals of Breaking Ekadashi Fast,Religion
"Ashadhi Ekadashi 2024: Date, Parana Time, Puja Rituals and Significance of Devshayani Ekadashi",Religion
"Harela 2024: Date, Celebration, Significance and All you need to know",Religion
Tulsi Worship and Care Guide for Home,Religion
"Devshayani Ekadashi 2024 Date: Parana Time, Puja Rituals, Fasting Rules and Significance of Ashadhi Ekadashi",Religion
"Masik Durgashtami 2024: Date, Shubh Muhurat, Puja Rituals and Significance",Religion
Sawan 2024 Start and End Date: Puja Rituals and Significance,Religion
Devshayani Ekadashi 2024: When is Devshayani Ekadashi? Know Date and Parana Time,Religion
"Skanda Sashti July 2024: Date, Time, Rituals and Significance",Religion
"Vinayak Chaturthi July 2024: Date, Time, Rituals and Significance",Religion
"Ashadha Amavasya 2024: Date, Time, Rituals and Significance",Religion
"Budh Pradosh Vrat in July 2024: Date, Time, Puja Rituals and Significance",Religion
