Headline,Genre
"Changes in LTCG tax post Budget 2024: Higher tax rate with indexation benefits, grandfathering for ancestral properties being considered?The Modi government's Union Budget 2024 proposed reducing the LTCG tax on property to 12.5% and eliminating indexation for post-April 2001 purchases. Industry groups are suggesting a gradual shift and options for higher tax rates with indexation. The finance ministry is reviewing these proposals.",Business
Budget 2024 adopts multifaceted approach to bolstering manufacturing sector,Business
How Budget 2024 aims to ignite the Viksit Bharat engine,Business
Are NPS Vatsalya & hiked NPS deduction limit for private sector employees good moves from Budget 2024? Experts decode,Business
Gold import duty cut: Why Indians may not find buying gold from Dubai as attractive post Budget 2024,Business
Are NPS Vatsalya & hiked NPS deduction limit for private sector employees good moves from Budget 2024? Experts decode,Business
New Budget 2024 rule: Why Income Tax Department is likely to issue a huge number of tax notices this month,Business
"Budget 2024: Top execs of Transsion, HTech and Benq applaud FM",Business
What does Union Budget bring to Auto Inc's table: Industry reactions on Budget 2024,Business
"Changes in LTCG tax post Budget 2024: Higher tax rate with indexation benefits, grandfathering for ancestral properties being considered?",Business
Budget 2024 highlights infrastructural surge and transformative vision for Eastern states,Business
"Budget 2024: “We welcome the provisions presented by Finance Minister Nirmala Sitharaman,” says GM of Eros Hotel New Delhi, Davinder Juj",Business
Budget 2024: Study in India & get Rs 10 lakh cheap higher education loan,Business
07:25'Adani-Ambani...Arre Sorry!': Rahul Gandhi's Remark Sparks Chaos In Lok Sabha | Watch,Business
07:25'Adani-Ambani...Arre Sorry!': Rahul Gandhi's Remark Sparks Chaos In Lok Sabha | Watch,Business
"05:24Rahul Gandhi Triggers Ugly Spat In Fiery LS Speech | 'Modi-led Chakravyuh,' 'Kamal' & India 'Trap'",Business
03:12Kharge Smiles As Dhankhar Mocks 'Peaceful' Congress MPs In Rajya Sabha | Watch Banter,Business
03:25Owaisi Quotes Pak Poet In Attack On Modi Govt; 'FM Nirmala Can Tax Unemployed Too' | Watch,Business
04:26Budget 2024: Good News For Indians Planning To Get Married: Watch Why,Business
"05:48Budget 2024: Rahul Gandhi Leads Opposition's Big Attack On Modi Govt | 'Copy Paste, Appeasement...'",Business
"Changes in LTCG tax post Budget 2024: Higher tax rate with indexation benefits, grandfathering for ancestral properties being considered?",Business
"Budget 2024: Clean energy gets duty boost, transition roadmap en route",Business
FM Sitharaman announces major rural development initiatives in budget 2024,Business
Budget 2024: Major boost for MSMEs with new credit schemes and technological upgrades,Business
Budget 2024: Big role for small reactors in India's N-power play,Business
Latest NPS rules 2024: How much tax will you save with new NPS contribution benefit under new regime after Budget 2024?,Business
"Budget 2024: Seventh speech, 71 rounds of applause",Business
"PM Modi: Budget brings new scale to education, skill development",Business
Budget's big job: Get back BJP's lost votes,Business
"Budget 2024: With 'Purvodaya' plan, centre looks at eastern states",Business
Andhra Inc stocks lap up coalition dhan,Business
Fine for non-reporting of overseas assets in I-T returns relaxed,Business
"Gold cheaper by Rs 4,000 in a day, bad news for smugglers",Business
Angel tax axe opens funds-gate for startups,Business
Long & Short: Finance minister's capital gain is bullish street's loss,Business
New Pension Scheme has just got more attractive. Here's how,Business
Eyeing your share: Buyback will now be taxed as dividend income,Business
How Budget 2024 aims to ignite the Viksit Bharat engine,Business
Govt proposes 'Bhu-Aadhaar' and other reforms to digitise land records,Business
Ashneer Grover says its better to 'watch another Ambani wedding' over Budget,Business
Budget 2024 income tax expectations for senior citizens: What are the top things FM Sitharaman can do for senior citizens?,Business
Union Budget 2024: How India’s true growth potential can be unlocked,Business
"Beware of ITR refund scam! You may lose lakhs with new income tax refund fraud - check I-T department advisoryBeware of Income Tax Refund scams! To avoid falling victim to such scams, taxpayers are recommended to verify any communication from the I-T department through official channels. ",Business
What are the minimum balance charges of savings account? HDFC Bank vs ICICI Bank vs PNB vs SBI vs Yes Bank compared,Business
FD interest rates set to fall? Why investing in long-term fixed deposits may make sense right now,Business
SIPs: This mutual fund equivalent of bank recurring deposits can make you a crorepati - here’s how,Business
What is 24 karat gold? Know difference between 999 vs 995 fineness gold,Business
How is gold jewellery price calculated by jewellers? Check top points before buying gold on Akshaya Tritiya,Business
New process in works for faster transfer of old unclaimed shares to beneficiaries,Business
Planning to invest in NPS? Top 5 reasons you should consider National Pension System,Business
SEBI makes nomination optional for joint mutual fund accounts; check details,Business
When will gold prices hit Rs 2 lakh mark? Here’s what experts say,Business
Mutual Fund KYC issues: What problems are MF investors facing with new rules and how they can check their KYC status,Business
"New mutual fund KYC rules: Is your KYC validated, verified, registered or on hold? Find out",Business
What is the power of compounding? Starting SIP investments early can yield long-term returns,Business
FD interest rates set to fall? Why investing in long-term fixed deposits may make sense right now,Business
Which corporate fixed deposits offer highest interest rates? Check list of 10 corporate FDs,Business
EPFO extends auto claim settlement to cover these conditions as well - check details,Business
Senior citizen FD rates: Banks offering up to 8.6% - check list here,Business
Investing in a Post Office Savings Scheme? Make sure PAN-Aadhaar details match - here’s why it’s important,Business
Beware of ITR refund scam! You may lose lakhs with new income tax refund fraud - check I-T department advisory,Business
ITR Filing FY 2023-24: Which is the correct Income Tax Return form for salaried taxpayers - ITR-1 or ITR-2? Find out,Business
"ITR Filing FY 2023-24: What happens if I file income tax return after deadline? Check penalties, consequences for late filing",Business
ITR Filing FY 2023-24: What is Form 16 and how you can download it to file your income tax return,Business
ITR filing FY 2023-24: What is the penalty for late filing of income tax return? Check penalties for misreporting tax & other mistakes,Business
ITR filing FY 2023-24 tips: Top tax deductions you shouldn’t miss under old and new tax regime to reduce tax outgo,Business
ITR filing: Important to track your income tax return status - how long does I-T department take to process returns?,Business
Form 16 for ITR filing: Top points to check in Form 16 before filing your income tax return for FY 2023-24,Business
Top 5 tax-saving bank FDs: Which banks offer high interest rates & how much will your money grow? Check list,Business
Income Tax Return Filing: Is it compulsory to file ITR if income does not exceed Rs 7 lakh?,Business
ITR filing FY 2023-24: Why is Form 16 important for salaried individuals when filing income tax return?,Business
Form 26 AS: Filing Income Tax Return? Know why Form 26AS is important & how to download it,Business
What are the minimum balance charges of savings account? HDFC Bank vs ICICI Bank vs PNB vs SBI vs Yes Bank compared,Business
What is an Aadhaar ATM? How to access India Post Payments Bank AePS services from home for urgent cash needs,Business
"Penal charge, interest on your loan? New RBI rules from April 1 - what borrowers should know",Business
SBI festive dhamaka scheme: Get personal loan up to Rs 20 lakh with zero processing fee; details here,Business
What is uniform KYC? From bank accounts to mutual funds - here’s what can change for customers,Business
Top tips to avoid banking and financial frauds in the name of KYC updation,Business
Your bank account and UPI: Some common questions answered,Business
Stuck or failed UPI transactions: Common issues and how to deal with them,Business
Bank locker rules: 5 things to know if you have a bank locker or plan to open one,Business
When does a bank account go dormant? You can reactivate it at no cost - here's how,Business
How to grow your money: Ankur Warikoo & StockGro's Ajay Lakhotia share top 5 investment mantras at TOI's Right To Excellence Financial Literacy Summit,Business
TOI’s new campaign ‘India for Financial Literacy’ kicks off with summit promoting finance education,Business
38:58Money Mantra Ep 5 | Labour Law Advisor founders Rishabh Jain and Mandeep Gill share their content creation journey,Business
38:58Money Mantra Ep 5 | Labour Law Advisor founders Rishabh Jain and Mandeep Gill share their content creation journey,Business
19:03Money Mantra Ep 4 | How content creator Neha Nagar mixes finance education with entertainment,Business
26:18Money Mantra Ep 3 | How Prakash Gaba started investing at the age of 47,Business
20:05Shreya Jaiswal’s incredible journey from CA to content creation,Business
42:38Raj Shamani shares secrets on money & early retirement with Ajay Lakhotia | Money Mantra Ep1,Business
"Avoid higher EMIs, interest rates! Planning to take a loan? Here's how your credit score impacts loan rate, EMIs",Business
"Credit limit, billing cycle and 10 other important credit card terms you must know",Business
How to get your CIBIL credit score without a PAN card,Business
"New RuPay credit card rules: Use UPI app to apply for EMIs, pay bills, increase limit & more",Business
"Penal charge, interest on your loan? New RBI rules from April 1 - what borrowers should know",Business
Motor insurance: 8 key factors to consider when choosing the right policy,Business
Health insurance rules: AYUSH Treatment coverage to match conventional care? Top things to know,Business
IRDAI's draft guidelines to protect insurance policyholders: 5 key changes to know,Business
What is the 30-30-30-10 rule for retirement planning?,Business
"Switching jobs? Your EPF account can be automatically transferred - here’s how EPFO facility works, rules and exceptions",Business
New NPS rule from April 1 requires two-factor Aadhaar authentication; here’s how it works - step-by-step guide,Business
"Now, update KYC details for your EPF account online - detailed guide to new provident fund process",Business
"EEE investments: Get completely tax-free returns with these investments - PPF, EPF and SSY; check details",Business
Raising Financially Savvy Kids: Age-Appropriate Money Management Education for the Next Generation,Business
Entrepreneurship and financial literacy for women,Business
Empowering Futures: The Role of Government Policies in Enhancing Financial Literacy,Business
Financial Literacy for Small Business Owners: Key Strategies for Success,Business
The role of employers in promoting financial literacy among employees,Business
"How much gold can you buy in cash and are PAN, Aadhaar details mandatory? Here’s what legal experts say",Business
Do you have unclaimed dividends and shares? Here’s how they can be recovered,Business
What are debt mutual funds? Benefits of investing,Business
New Mutual Fund KYC rules from April 1: Which documents are not valid now and what is the process to be KYC compliant?,Business
Are thematic funds meant for you? Check benefits and risks,Business
First-time MF investor? Here’s what you need to know - from documents to nominee,Business
What are Systematic Transfer Plans? Benefits of staggering equity MF investments through STPs,Business
Can mutual fund investments be made in a child’s name?,Business
What does portfolio overlap in mutual funds mean? Tips to avoid it,Business
What are flexi cap funds? Here are the benefits of investing in them,Business
"Stock market today: BSE Sensex opens in red; Nifty50 near 24,650Stock market today: BSE Sensex and Nifty50, the Indian equity benchmark indices, opened in red on Wednesday. While BSE Sensex was above 80,700, Nifty50 was above 24,650. ",Business
CCI flags concerns over cricket rights with Reliance-Disney $8.5 billion merger,Business
Private capex set to surge 54% to Rs 2.5 lakh crore in FY25: RBI study,Business
Optiemus bags order from Tata group's Tejas,Business
"Hiring sentiment up 8% in July-December 2024, says report",Business
"Rising aspirations behind deposit shift, says RBI governor Shaktikanta Das",Business
38:58Money Mantra Ep 5 | Labour Law Advisor founders Rishabh Jain and Mandeep Gill share their content creation journey,Business
38:58Money Mantra Ep 5 | Labour Law Advisor founders Rishabh Jain and Mandeep Gill share their content creation journey,Business
Dhan Ki Baat | Role of policy making in financial literacy,Business
19:03Money Mantra Ep 4 | How content creator Neha Nagar mixes finance education with entertainment,Business
22:29Dhan Ki Baat | Understanding how youth perceive financial literacy,Business
26:18Money Mantra Ep 3 | How Prakash Gaba started investing at the age of 47,Business
Dhan Ki Baat | Decoding the next decade of India’s stock market,Business
"Pakistan inflation slows to 23.1% yr/yr in Feb, lowest since mid-2022Pakistan's consumer price index for February increased by 23.1% YoY, the slowest since June 2022. Inflation reached an all-time high of 38% in May 2021, but is projected to ease in the coming months. The government's funding agreement with the IMF expires on April 11.",Business
World Bank maps out plans to further boost lending by $100 bln-plus over a decade,Business
"Apple, Google agreed to ‘defend’ search deal from regulators",Business
CoinEx invites hackers to negotiate after suffering data breach,Business
Chinese AI firm Fourth Paradigm leads Hong Kong IPO surge to raise $280 million,Business
Gold shrugs off hawkish Powell to start data-packed week,Business
38:58Money Mantra Ep 5 | Labour Law Advisor founders Rishabh Jain and Mandeep Gill share their content creation journey,Business
38:58Money Mantra Ep 5 | Labour Law Advisor founders Rishabh Jain and Mandeep Gill share their content creation journey,Business
Dhan Ki Baat | Role of policy making in financial literacy,Business
19:03Money Mantra Ep 4 | How content creator Neha Nagar mixes finance education with entertainment,Business
22:29Dhan Ki Baat | Understanding how youth perceive financial literacy,Business
26:18Money Mantra Ep 3 | How Prakash Gaba started investing at the age of 47,Business
Dhan Ki Baat | Decoding the next decade of India’s stock market,Business
"Sensex snaps 5-day losing streak on value-buyingSensex snaps 5-day losing streak on value-buying; Nifty closes near 17,000 level",Business
Indian shares hit 5-month low on worries over US banking crisis,Business
"Sensex, Nifty rise in early trade",Business
"Sensex, Nifty close higher for 2nd day on gains in global equities; IT, financials shares advance",Business
FPIs extend selling in Indian equities in February: NSDL data,Business
"Sensex crosses 60,000 level in early trade; Nifty tests 17,700",Business
38:58Money Mantra Ep 5 | Labour Law Advisor founders Rishabh Jain and Mandeep Gill share their content creation journey,Business
38:58Money Mantra Ep 5 | Labour Law Advisor founders Rishabh Jain and Mandeep Gill share their content creation journey,Business
Dhan Ki Baat | Role of policy making in financial literacy,Business
19:03Money Mantra Ep 4 | How content creator Neha Nagar mixes finance education with entertainment,Business
22:29Dhan Ki Baat | Understanding how youth perceive financial literacy,Business
26:18Money Mantra Ep 3 | How Prakash Gaba started investing at the age of 47,Business
Dhan Ki Baat | Decoding the next decade of India’s stock market,Business
"Fried acknowledges 'mistakes'; testifies he didn't defraud anyoneSam Bankman-Fried, testifying in his own defense at his fraud trial on Friday, acknowledged that a ""lot of people got hurt"" when the FTX cryptocurrency exchange he founded collapsed, but said he did not defraud anyone or take customer funds. Shortly after taking the witness stand in Manhattan federal court, Bankman-Fried said he made ""a number of small mistakes and a number of larger mistakes"" while running the now-bankrupt exchange. The biggest mistake, he said, was not implementing a dedicated risk management team.",Business
"Crypto isn’t dead, it’s evolving rapidly to create a new world",Business
"US tightens crackdown on crypto with lawsuits against Coinbase, Binance",Business
02:25Most common crypto scams,Business
02:25Most common crypto scams,Business
02:276 Tips to keep your crypto investments safe,Business
02:345 mistakes to avoid while trading in crypto,Business
01:45What is crypto mining?,Business
02:14Decoding the Bitcoin White Paper,Business
02:02Decoding the history of cryptocurrency,Business
Bitcoin posts longest winning run since March on rate-cut wagers,Business
Ether jumps to 11-month high in wake of software upgrade,Business
Crypto investors pull $3 billion from stablecoin USDC in three days,Business
"Cryptocurrency Prices Today: Cardano loses more than 4%, Dogecoin sheds over 3%",Business
"Cryptocurrency Prices Today: Bitcoin and Ethereum fall, Dogecoin sheds 4%",Business
Amitabh Bachchan's exclusive NFT collection auctioned for over Rs 7 crore,Business
Elon Musk hails Dogecoin as ‘people’s crypto’,Business
Robinhood partners with USD Coin issuer to bring first stablecoin,Business
What all lies the Q1 2022 crypto report: Binance Study,Business
Tether Operations Limited brings a new fiat-pegged token tied to the value of the Mexican peso,Business
Central banks at Davos 2022 showed the way for implementing CBDCs,Business
"Leading crypto firms jointly launch a new, multi-chain crypto scam reporting platform",Business
"Loan borrowers take note! Now, know all-inclusive interest cost for your loan, RBI announces new measures - all about Key Fact Statement",Business
"New NPS partial withdrawal rules: How National Pension System rules work, reasons, limits, when to opt for them and more FAQs answered",Business
Investors' wealth jump Rs 4.21 lakh crore on market rally,Business
Nippon India launches two index funds: Nifty IT index and Bank Index,Business
Income Tax Returns 2023-24: CBDT notifies ITR-2 and ITR-3; key details taxpayers will have to now provide,Business
What is the Section 80C limit for tax deduction for FY 2024-25 after Interim Budget 2024?,Business
"Income Tax Slabs, Tax Rates 2024-2025 explained: Your full guide to latest income tax slabs FY25 after Interim Budget 2024 - FAQs answered",Business
"Budget 2024 income tax: Do you qualify for tax demand waiver of up to Rs 25,000? Here’s all you need to know",Business
"Budget 2024 income tax: Can common man, middle class look forward to relief on tax slabs, tax rates? Here’s what experts say in TOI Online Survey",Business
"Republic Day 2024 Sales: What is No-cost EMI? Must-know pricing structure, hidden charges, benefits and more",Business
Mutual Funds Surge: India's Financial Evolution Unveiled,Business
"Beware of credit card traps! How to avoid high interest, debt trap & more: FAQs answered",Business
Senior citizen savings scheme: Know SCSS interest rate for the January-March 2024 quarter,Business
Should you invest in PPF? Top benefits of Public Provident Fund you shouldn’t miss,Business
Stay invested through market highs & lows,Business
SIPs become cushion against FPI selling,Business
When will your loan EMIs start coming down? What RBI keeping repo rate unchanged signals,Business
Explained: What is the new Discard Income Tax Return option? Benefits for taxpayers & all FAQs answered,Business
"Know Alpha, Beta to understand risk of your mutual fund",Business
"Sensex nears 79,000, RIL's mcap back above Rs 20 lakh croreThe stock market witnessed significant movements today, with various sectors experiencing both growth and setbacks. From blue-chip rallies to individual stock announcements, the day was filled with dynamic market activities.",Business
"Sensex breaches 78,000 mark for 1st time, Nifty at record high as bank stocks surge",Business
Sensex closes 523 points lower on profit taking,Business
Sovereign Gold Bonds to be issued from February 12-16: Invest in gold with tax benefits and interest,Business
Bank of India MF aims to raise Rs 500 crore from multi-asset allocation fund in NFO period,Business
38:58Money Mantra Ep 5 | Labour Law Advisor founders Rishabh Jain and Mandeep Gill share their content creation journey,Business
38:58Money Mantra Ep 5 | Labour Law Advisor founders Rishabh Jain and Mandeep Gill share their content creation journey,Business
Dhan Ki Baat | Role of policy making in financial literacy,Business
19:03Money Mantra Ep 4 | How content creator Neha Nagar mixes finance education with entertainment,Business
22:29Dhan Ki Baat | Understanding how youth perceive financial literacy,Business
26:18Money Mantra Ep 3 | How Prakash Gaba started investing at the age of 47,Business
Dhan Ki Baat | Decoding the next decade of India’s stock market,Business
Select a City,Life-Style
Is bad mood affecting your work or daily life?,Life-Style
11 minutes of walking can unlock these benefits,Life-Style
"8 reasons to start, finish your day with jeera water",Life-Style
All about Neem Karoli baba,Life-Style
10 dazzling pics of meteor showers by NASA,Life-Style
"Don't scold your child, do this instead",Life-Style
 ‘Aasa Kooda’ girl Preity is so stylish,Life-Style
Videos,Life-Style
Is Your Relationship Falling Apart? These 5 Things Could Be ...,Life-Style
Homeopathy Under The Microscope: Expert Busts Myths Around A...,Life-Style
"Your Ticket Out of Karma: Bhagavad Gita, Chapter 4, Verse 11",Life-Style
Tips to Manage Kids' Sweet Cravings for Better Health,Life-Style
"Homecooked Meals Key to Brain Health, Experts Suggest",Life-Style
6 variations of push-ups for hitting different body muscles,Life-Style
"Late Dinners Linked to High Cholesterol Levels, Experts Warn",Life-Style
Yoga poses for neck pain relief and mobility improvement,Life-Style
Critical signs that indicate the onset of a liver disease,Life-Style
Break Free from Anxiety: Discover The Power of Letting Go Wi...,Life-Style
Other Group Sites,Life-Style
Select a City,Life-Style
Signs of an indecisive partner and how to deal with them,Life-Style
Psychological tips and tricks to appear smart without speaking,Life-Style
10 unique pet dog names inspired by Greek mythology,Life-Style
"Is bad mood affecting your work, relationships, or daily life?",Life-Style
Gaurang Das reveals 3 signs of genuine friends,Life-Style
Why are women emotional?,Life-Style
Sudha Murty responds to trolls: Stories about Rakhi,Life-Style
Videos,Life-Style
Is Your Relationship Falling Apart? These 5 Things Could Be ...,Life-Style
Homeopathy Under The Microscope: Expert Busts Myths Around A...,Life-Style
"Your Ticket Out of Karma: Bhagavad Gita, Chapter 4, Verse 11",Life-Style
Tips to Manage Kids' Sweet Cravings for Better Health,Life-Style
"Homecooked Meals Key to Brain Health, Experts Suggest",Life-Style
6 variations of push-ups for hitting different body muscles,Life-Style
"Late Dinners Linked to High Cholesterol Levels, Experts Warn",Life-Style
Yoga poses for neck pain relief and mobility improvement,Life-Style
Critical signs that indicate the onset of a liver disease,Life-Style
Break Free from Anxiety: Discover The Power of Letting Go Wi...,Life-Style
Poll of the day,Life-Style
Other Group Sites,Life-Style
"NTA releases NEET UG 2024 result ahead of time, official cut-offs awaited: Check last year's trends, closing ranks for AIIMS and other government medical colleges",Education
5 high-return upskilling courses for engineers who aspire to rise up the ladder fast,Education
5 summer internships at the country’s top IITs you can apply for in 2024,Education
UGC NET Exam 2024 on June 18: Section-wise important topics you must revise,Education
Want to Pursue Graduation in Karnataka? Here Are the Top 7 NIRF-Ranked Colleges,Education
"UGC grants autonomy to 8 universities including DU, view full list here",Education
KIIT’s Six Engineering Programmes Get ABET (US) Accreditation,Education
KPSC KAS Hall Ticket 2024 Out at kpsc.kar.nic.in; Check Direct Link Here,Education
Schools closed tomorrow due to Bharat Bandh? Here's what we know so far,Education
"SSC MTS recruitment notification 2024 OUT: Registration window open for 8326 posts, direct link to apply here",Education
"IBPS CRP RRB XIII Recruitment 2024: Application window for 9,995 vacancies closes today, direct link to apply NOW",Education
Decoded: Centre’s anti paper leak law which came into effect amidst NEET and NET scam; check offences and punishments,Education
HPBOSE Announces Class 10 Revaluation Result 2024 at hpbose.org: Check Direct Link Here,Education
CISCE ISC Improvement Results 2024 Announced at cisce.org: Direct Link,Education
"MPBSE Madhya Pradesh Board 10th, 12th Supplementary Results 2024 Announced at mpresults.nic.in: Check Direct Links Here",Education
KPSC KAS Hall Ticket 2024 Out at kpsc.kar.nic.in; Check Direct Link Here,Education
Schools closed today due to Bharat Bandh? Here's what we know so far,Education
"CSAB 2024 supernumerary round seat allotment result released at csab.nic.in, here’s the direct link to check",Education
