Headline,Genre
Here's why Nitesh selected Ranbir for 'Ramayana',Entertainment
Tanushree Dutta criticises Hema Committee report,Entertainment
Michael C. Hall returns to the ‘Dexter’ universe,Entertainment
Behind the scenes moments with Bollywood stars,Entertainment
Confirmed! JL files for divorce from Ben Affleck,Entertainment
Vicky and Katrina visit Zoya Akhtar's house,Entertainment
Ameesha Patel demands rapists be shot dead,Entertainment
Ananya Panday shimmers in a hazel sculpted dress,Entertainment
Natasa spends quality time with son Agastya by the pool,Entertainment
"Khel Khel Mein, Vedaa box office collection day 6",Entertainment
Stree 2 box office collection day 6,Entertainment
Swift's ex-beau Lautner attends Eras Tour with wife Tay,Entertainment
Adil on glorification of toxic masculinity in films,Entertainment
Babil Khan pens an emotional note on Billu Barber,Entertainment
"Swift's dad gifts guitar picks to Tatum, Kravitz",Entertainment
Here's why Nitesh selected Ranbir for 'Ramayana',Entertainment
Tanushree Dutta criticises Hema Committee report,Entertainment
Michael C. Hall returns to the ‘Dexter’ universe,Entertainment
Behind the scenes moments with Bollywood stars,Entertainment
Vicky and Katrina visit Zoya Akhtar's house,Entertainment
Ameesha Patel demands rapists be shot dead,Entertainment
PeeCee's Marathi film 'Paani' to release on October 18: All you need to know,Entertainment
Anirudh shares an update on 'Vettaiyan' first single 'Manasilayo',Entertainment
'Ponniyin Selvan' dominates the 70th National Film Awards,Entertainment
'Kantara' wins big at the National Film Awards,Entertainment
'KGF 2' bags 2 National Awards,Entertainment
'Thangalaan' review and release LIVE Updates,Entertainment
"'Raayan' shatters records, joins the Rs.150 crore club",Entertainment
Former Indian Cricket Caption Sourav Ganguly & Dona To Take Over Kolkata Streets | Emotional Protest Over Kolkata Rape-Murder Case,Entertainment
Veteran Actress Neena Gupta’s Bold Style Shocks Everyone | Age-Shaming Trolls Explode In Comments,Entertainment
Sonakshi Sinha's Sudden House Sale: A Hidden Story?,Entertainment
"'It is the need of the hour', Actor Samantha's Jaw-dropping Response To Kolkata Rape-Murder Case",Entertainment
Yuvraj Singh’s Biopic Announced | Bhushan Kumar & Ravi Bhagchandka Join Forces,Entertainment
Meet Sarkata: Everything You Need to Know About the 7.7 Ft Tall Wrestler,Entertainment
Janhvi Kapoor's Rakhi Moment with Paparazzo Labeled A 'Publicity Stunt' By Trolls,Entertainment
"Shreyas Talpade Slams Death Hoax, Highlights Negative Effects on His Daughter",Entertainment
Anubhav Sinha's Sweet Gesture Towards Dia Mirza Leaves Netizens In Awe | Fans Declare Him a 'True Gentleman',Entertainment
Kolkata’s Doctor Horror: Actor Mithun Chakraborty DEMANDS Justice as Nation ERUPTS in Rage,Entertainment
Writer Sudha Murty's 'Karnavati-Humayun' Story For Raksha Bandhan; Netizens Say 'Absolute Rubbish',Entertainment
Arshad Warsi’s Social Media Flooded with Hate Over Prabhas Comment,Entertainment
Taylor Swift's ex-beau Taylor Lautner attends Eras Tour with wife Tay; couple's cryptic 'Aunt and Uncle' post spark rumours among Swifties,Entertainment
Sean 'Diddy' Combs accused of sex trafficking as Adria English files police report following $50 BILLION civil suit,Entertainment
Assistant reveals Matthew Perry's final words,Entertainment
Depp's 'Modi' biopic to premiere at San Sebastian Film Festival,Entertainment
Pitt and Jolie's daughter Shiloh granted name change,Entertainment
Top Kannada directors making waves in recent cinema,Entertainment
Nabha Natesh Unveils Her Bold New Fashion Era Looks,Entertainment
Surveen Chawla: Transitioning from shows to Punjabi films,Entertainment
In pics: Ritu Varma dazzles in glamorous outfits,Entertainment
Mom-to-be Rubina Bajwa's Most Surreal Suit Looks,Entertainment
Mithila Purohit wows with these gorgeous pics,Entertainment
Who is Imanvi? Prabhas' co-star in 'Fauji',Entertainment
Manasi Parekh's most dazzling pics,Entertainment
Sreeleela Teases the Fashion World with Her Calm and Classy Lehenga Collection,Entertainment
Celebrities who passed away during filming,Entertainment
Stunning pictures of Madonna Sebastian,Entertainment
Meenakshi Govindharajan: Pretty pictures of 'Demonte Colony 2' actress,Entertainment
Reports: Prashanth Neel and Jr. NTR's 'NTR31' to have a massive budget of Rs. 350 crore,Entertainment
Suresh Gopi on Hema Commission report: Such issues also exist in banking and other fields,Entertainment
"Grace Antony says, “Even those who have treated us well are being unfairly judged” following Hema Commission report",Entertainment
Mukesh Chhabra reveals why Nitesh Tiwari selected Ranbir Kapoor for Lord Rama in 'Ramayana',Entertainment
"Tanushree Dutta criticises Hema Committee report, calls it ‘useless’",Entertainment
Justice Hema Committee report: Sonia Thilakan criticizes AMMA and FEFKA,Entertainment
Nani's 'Saripodha Sanivaram' makers tease 8 high-impact sequences in the film,Entertainment
"Watch: Asif Ali asks about Mohanlal’s health, actor’s response delights fans",Entertainment
Priyanka Mohan reveals major update on Pawan Kalyan's 'OG' as shooting nears completion,Entertainment
Rishab Shetty slams Bollywood for negative depictions of India at global festivals,Entertainment
Confirmed! Jennifer Lopez officially files for divorce from Ben Affleck after two years of marriage - Deets inside,Entertainment
Surveen Chawla: Transitioning from shows to Punjabi films,Entertainment
Vicky Kaushal and Katrina Kaif step out in style as they visit Zoya Akhtar's house,Entertainment
Actors and their odd jobs before they hit big,Entertainment
Natasa Stankovic spends quality time with son Agastya as they chill by the pool,Entertainment
'I Got My Dinosaur' song from Vineeth Sreenivasan's 'Oru Jaathi Jaathakam' goes viral,Entertainment
In pics: Ritu Varma dazzles in glamorous outfits,Entertainment
"Khel Khel Mein and Vedaa box office collection day 6: Akshay Kumar's film earns just over Rs 1 crore, John Abraham starrer drops to Rs 60 lakh",Entertainment
"Live Score: Pakistan vs Bangladesh, 1st Test Day 1",Sports
When Tendulkar equalled Gavaskar's record of Test centuries,Sports
CCI flags cricket rights concerns with Disney-Reliance $8.5 billion merger,Sports
Ex-India bowling coach feels BCCI 'can't wrap Mayank Yadav up in cotton wool',Sports
"'Just 3 ODIs before Champions Trophy...': Wasim Jaffer 'concerned' about India's ODI schedule'Indians usually play on good wickets and small boundaries': Sri Lankan spinner after winning first ODI series in 27 Years'If we need to be different in terms of choosing personnel we will do that': Rohit Sharma after 2-0 series defeatDespite Rohit Sharma, Virat Kohli's presence, Team India's spin vulnerability exposed by record statDisappointed Rohit Sharma says batters need to seriously look at plans against spin",Sports
"T20 World Cup: ICC rates New York, Tarouba pitches as 'unsatisfactory'",Sports
'11 men healed us': Fans celebrate 1 month of India's title win,Sports
'If you want to grow the sport...': Dravid defends US leg of T20 WC,Sports
Watch: SKY talks about his T20 WC winning catch against SA,Sports
Ex-India coach feels BCCI 'can't wrap Mayank Yadav up in cotton wool',Sports
When Tendulkar equalled Gavaskar's Test tons record,Sports
"'Jaiswal a back-up for Champions Trophy, Rohit will open with...'",Sports
"Live Score: Pakistan vs Bangladesh, 1st Test Day 1",Sports
Sports Live: World No. 1 tennis player Sinner escapes doping ban,Sports
CCI flags cricket rights concerns with Disney-Reliance $8.5 billion merger,Sports
Watch: Footballer red-carded for urinating on the field,Sports
Top 5 current Test batsmen with the most runs,Sports
Top active cricketers with higher Test averages than Virat Kohli,Sports
Virat Kohli's record-breaking journey: All major milestones,Sports
Vinesh Phogat greeted with love upon return from Olympics setback,Sports
PM Modi meets Olympic heroes to celebrate India's glory,Sports
​​Paris Olympics: Indian athletes who finished just shy of the podium​,Sports
India's medal winners at the Paris 2024 Olympics,Sports
Paris Olympics conclude with spectacular closing ceremony,Sports
India's Olympic closing ceremony flagbearers since 2008,Sports
Wrestler Aman Sehrawat becomes India's youngest Olympic medallist,Sports
"Neeraj gets silver, hockey team bags bronze for India on Day 13",Sports
Heartbreak for Mirabai after Vinesh's disqualification on Day 12,Sports
India vs Bangladesh: When Sachin Tendulkar equalled Sunil Gavaskar's record of Test centuries,Sports
Remember Mayank Yadav? Former India bowling coach feels BCCI 'can't wrap the pacer up in cotton wool',Sports
Ranji Trophy: Rajasthan clubbed with 3 ex-champions,Sports
Sachin Tendulkar-backed Samat to take on Hadap for MCA secretary post,Sports
Competition Commission of India flags cricket rights concerns with Disney-Reliance $8.5 billion merger,Sports
"'Yashasvi Jaiswal a back-up for Champions Trophy, Rohit Sharma will open with...'",Sports
Mayank Rawat's all-round show helps East Delhi Riders register second straight win in DPL 2024,Sports
Sri Lanka skipper Dhananjaya de Silva hoping to make most of Ben Stokes injury,Sports
Shan Masood highlights 'leadership philosophy' as the key to Pakistan's turnaround before facing Bangladesh,Sports
ICC Chairman Election: All eyes on BCCI secretary Jay Shah as Greg Barclay to step down after current term,Sports
Cricket West Indies announces vice president election,Sports
Pitstop in Perth: Get ready for a heady mix of cricket & travel,Sports
It’s too close to call: Adam Gilchrist on upcoming India-Australia series,Sports
ICC Women's T20 World Cup to be moved to the UAE,Sports
Basil Thampi to lead Blue Tigers,Sports
Ollie Pope ready to lead England his way but glad of Ben Stokes support,Sports
Watch: Footballer red-carded for urinating on the field,Sports
Sporting midfielder Mateus Fernandes signs up with Southampton,Sports
Durand Cup: NEUFC take on Army as Lajong face EB test,Sports
Teams with overage players disqualified from Subroto Cup,Sports
Manchester City's Phil Foden wins PFA Player of the Year award,Sports
Right time for Manolo to take charge of national team: Brandon Fernandes,Sports
"Kolkata's 'Big Three' unite, demand justice and return of Durand Cup tournament to Maidan",Sports
'It's not easy to set a stable formation with nine players': India U20 head coach hails 1-0 win over Bhutan in SAFF opener,Sports
Bayern Munich's defender Josip Stanisic out for weeks with knee ligament tear,Sports
Atletico Madrid fight back for thrilling draw against Villarreal,Sports
Jannik Sinner cleared of wrongdoing after failed drug tests,Sports
"We represent our country even in ATP events, not just Davis Cup: Mukund Sasikumar",Sports
Why tennis star Jannik Sinner tested positive for steroids twice but faces no suspension,Sports
Sumit Nagal to feature in 6th Tennis Premier League,Sports
Jannik Sinner and Aryna Sabalenka win Cincinnati Open titles,Sports
Sumit Nagal's run ends at Winston-Salem open,Sports
"Jannik Sinner, Frances Tiafoe set up Cincinnati Open final",Sports
Aryna Sabalenka and Jessica Pegula to contest Cincinnati Open final,Sports
World No.1 Swiatek loses to Sabalenka in WTA Cincinnati semis,Sports
Novak Djokovic blasts 'embarrassing' lack of video replays in tennis,Sports
"Top-ranked stars Jannik Sinner, Iga Swiatek rally to reach semis at Cincinnati Open",Sports
Carlos Alcaraz says sorry for racquet smash in 'worst' career loss,Sports
"Nagpur shuttler Rohan qualifies for main draw, ousted in round 1 of Indonesia International Challenge",Sports
"Malvika Bansod, Ashmita Chaliha make early exit from Japan Open",Sports
Teenage shuttler Parul Choudhary gears up Junior Asian Badminton Championships,Sports
"Confident junior Indian badminton squad targets multiple medals at BAC Under-15, Under-17 Championships",Sports
India to send 39-member squad to junior badminton championships,Sports
"Saina Nehwal hits back at trolls after javelin comment, says comparison to Kangana Ranaut is a compliment",Sports
Saina Nehwal honored with the Suryadatta national award,Sports
"Double crown for Aryan Tyagi, Murli Sharma; Parul Choudhary triumphs in Rajasthan Junior State Badminton Championship",Sports
'Also now you're a married man...': Taapsee Pannu's funny response to Mathias Boe's retirement from coaching,Sports
Junior shuttlers unhappy with BAI's entry cap,Sports
President Droupadi Murmu plays badminton with Saina Nehwal at Rashtrapati Bhavan,Sports
"Somaya, Pawar bat for Chirag Shetty's equality call",Sports
"Indian shuttlers Tasnim Mir, M Tharun win International Challenge singles titles",Sports
"Nothing against cricketers, treat all sports equally: Chirag Shetty",Sports
Shuttler Priyanshu Rajawat stuns world No. 4 Anders Antonsen to enter Canada Open semis,Sports
No visa forces Lakshya Sen to pull out of Canada Open,Sports
Key players to be rested for Asian Champions Trophy,Sports
Have to prepare mentally to transition from player to coach: PR Sreejesh,Sports
'Road to LA 2028': Harendra wants women's team to forget the past,Sports
"After Paris bronze, Manpreet Singh keen on playing at LA 2028",Sports
Shoving match at face-off: Tyson says Jake will 'run like a thief' - Watch,Sports
BFI invites application for new foreign coach,Sports
No medal for Indian boxers a result of poor planning,Sports
Crawford dethrones Madrimov for WBA super-welterweight title,Sports
Jose Luis Ballester makes history as first Spanish player to win US Amateur,Sports
Tiger Woods' teen son Charlie misses cut at US Junior Amateur,Sports
Tiger Woods at junior amateur to watch son Charlie,Sports
Career-best round at Open gives Shubhankar Sharma big boost ahead of birthday,Sports
"'Yashasvi Jaiswal a back-up for Champions Trophy, Rohit Sharma will open with...'",Sports
"You don't have to become doctor or engineer, sports life is a beautiful life: Manu Bhaker",Sports
"'He's a nightmare!': For Ricky Ponting, this India pacer is 'the best' and getting better year on year",Sports
Vinesh Phogat may contest Haryana Assembly polls against cousin Babita: Sources,Sports
"Robin Uthappa opens up on battle with depression, says 'was ashamed of who I had become as a human being'",Sports
"In never-seen-before avatar, double-Olympic medallist Manu Bhaker grooves to 'Kala Chashma'. Watch",Sports
ICC Chairman Election: All eyes on BCCI secretary Jay Shah as Greg Barclay to step down after current term,Sports
Wasim Akram's wife teases Pakistan bowling great with his bald picture on wedding anniversary,Sports
MS Dhoni enjoys meal at a dhaba with close friends,Sports
"ICC moves Women's T20 World Cup out of Bangladesh, to now take place in...",Sports
When and where to watch Pakistan vs Bangladesh live in India?,Sports
"“I think the time is right, a good farewell”- WWE Hall of Famer Rey Mysterio Reveals His Retirement Plans",Sports
'Pichle saal Rs 500 diye the': Vinesh Phogat shows off money received during Raksha Bandhan celebration. Watch,Sports
"Amid uncertainty over Team India's travel to Pakistan, PCB chief says Champions Trophy matches, including final will be played in the country",Sports
'Misleading': PCB blasts media reports claiming rescheduling of 2025 ICC Champions Trophy,Sports
"Sourav Ganguly clarifies 'stray incident' comment, joins online movement for justice in Kolkata trainee doctor case",Sports
India vs Bangladesh: When Sachin Tendulkar equalled Sunil Gavaskar's record of Test centuries,Sports
Watch: Footballer red-carded for urinating on the field,Sports
"""I wanted to have that one match..”: The Undertaker opens up about the WrestleMania 36 match",Sports
"Nagpur shuttler Rohan qualifies for main draw, ousted in round 1 of Indonesia International Challenge",Sports
Sporting midfielder Mateus Fernandes signs up with Southampton,Sports
"Raunak Sadhwani joint second, Divya Deshmukh at third in Abu Dhabi Masters chess festival",Sports
Remember Mayank Yadav? Former India bowling coach feels BCCI 'can't wrap the pacer up in cotton wool',Sports
Ranji Trophy: Rajasthan clubbed with 3 ex-champions,Sports
Durand Cup: NEUFC take on Army as Lajong face EB test,Sports
Jade Cargill,Sports
Dominik Mysterio,Sports
Cody Rhodes,Sports
Rhea Ripley,Sports
Odyssey Jones,Sports
Britt Baker,Sports
Randy Orton,Sports
Penta el Zero,Sports
Tony Khan,Sports
Joe Hendry,Sports
Nic Nemeth,Sports
Metro Boomin,Sports
Bron Breakker,Sports
"Mukesh Ambani, Elon Musk, Bill Gates, Jeff Bezos, and 11 others worth more than Google",Technology
Gmail’s new Polish feature transforms rough notes into full draft,Technology
"Oppo F27 5G smartphone with Halo Light ring design, IP64 rating launched in India: Price, offers and more",Technology
Garena Free Fire MAX redeem codes for August 21: Win free rewards and gifts,Technology
How to protect your WhatsApp account: Common mistakes that lead to hacking,Technology
Jio's choice number scheme: What is it and how to obtain a customised Jio phone number,Technology
Creating a strong password: Essential tips for enhanced online security,Technology
How to prevent WhatsApp from auto-saving media to your gallery?,Technology
Gmail’s new Polish feature transforms rough notes into full draft,Technology
"Mukesh Ambani, Elon Musk, Bill Gates, Jeff Bezos, and 11 others worth more than Google",Technology
"Authors sue Amazon-backed Anthropic, claiming the company has ""built a multibillion-dollar business by stealing….”",Technology
"Google is bringing this iPhone-like feature on Chrome for Android, PC",Technology
"Oppo F27 5G smartphone with Halo Light ring design, IP64 rating launched in India: Price, offers and more",Technology
"Moto Razr 50 to launch in India soon, company teases design and cover display",Technology
Qualcomm Snapdragon 7s Gen 3 mobile platform with generative AI capabilities launched,Technology
Realme 13 series to launch in India on August 29: Here’s what the smartphone will offer,Technology
Garena Free Fire MAX redeem codes for August 21: Win free rewards and gifts,Technology
"Wordle 1159 Puzzle for August 21, 2024: Hints, clues and solution for word of the day",Technology
This video game backed by PUBG-maker Tencent has created a new record,Technology
Nintendo's first-ever museum to open in Kyoto this October,Technology
"Huawei Watch GT 4 with up to 14 days battery life, stainless steel design launched, priced at Rs 14,999",Technology
Google Pixel Watch 3 introduces ‘Loss of Pulse Detection’ feature: What is it and how it will help users,Technology
Apple rolls out fourth watchOS 11 public beta,Technology
"Google launches Pixel Watch 3 in India, comes in two sizes with improved health tracking and more",Technology
WhatsApp users on Android to soon get a new security feature: Here’s what it is,Technology
"Elon Musk says first Supermoon of 2024 ""looks amazing"": What is so special about it",Technology
Blinkit Rakhi jibe at Zomato: ...itna bada hogaya pata nahi kab seekhega,Technology
Enhance your iPhone photography: 5 essential camera settings to adjust,Technology
"OnePlus Buds 3 Pro with up to 43-hour battery life launched in India: Price, specs, and more",Technology
"Marshall launches Emberton III, Willen II speakers in India",Technology
Apple may launch two new AirPods at its September event,Technology
"Boat Nirvana Ion ANC India-themed special edition TWS launched, priced at Rs 3,499",Technology
Tata Power employee raises concerns over the company’s alleged forced laptop buyback policy,Technology
"HP leads as Acer sees highest growth in India's PC market, claims report",Technology
Windows AI-capable PC shipments grow 127% but Apple still leads market,Technology
Apple may not fulfill this macOS promise it made four years ago,Technology
"Gigabyte Aorus OLED monitors launched in India: Price, specs and more",Technology
"Sony launches Bravia 9 Mini LED TV series in India: Available in 75, 85-inch sizes, starting at Rs 4,49,990",Technology
"Apple working on home robot project, may launch an iPad attached to a robotic arm",Technology
"LG Electronics offers discounts on water purifiers, refrigerators, and more on Independence Day",Technology
"Moto G85 review: Artfully designed, sensibly priced",Technology
Realme 13 Pro+ 5G review: A solid mid-range camera phone,Technology
Oppo Reno 12 Pro 5G review: Design and camera delight,Technology
Boat Nirvana Zenith TWS review: For bass lovers,Technology
"Stock market today: BSE Sensex opens in red; Nifty50 near 24,650Stock market today: BSE Sensex and Nifty50, the Indian equity benchmark indices, opened in red on Wednesday. While BSE Sensex was above 80,700, Nifty50 was above 24,650. ",Business
Private capex set to surge 54% to Rs 2.5 lakh crore in FY25: RBI study,Business
"Rising aspirations behind deposit shift, says RBI governor Shaktikanta Das",Business
Why it’s time to explore bold & path-breaking alternatives that put Indian Railways on a smooth track,Business
Budget 2024 three times UPA's last Budget in 2014: PM Narendra Modi at CII post-Budget conference,Business
Are NPS Vatsalya & hiked NPS deduction limit for private sector employees good moves from Budget 2024? Experts decode,Business
Gold import duty cut: Why Indians may not find buying gold from Dubai as attractive post Budget 2024,Business
Gold losing sheen? Government cuts gold bond issuance target as investors look at better alternatives,Business
"Stock market today: BSE Sensex opens in red; Nifty50 near 24,650",Business
Optiemus bags order from Tata group's Tejas,Business
"Hiring sentiment up 8% in July-December 2024, says report",Business
"Rising aspirations behind deposit shift, says RBI governor Shaktikanta Das",Business
FDI inflows increase 26% in Q1 amid signs of pickup globally,Business
Mike Lynch was celebrating acquittal before violent storm hit,Business
"Oil rises nearly 2% on upbeat US economic data, geopolitical tensions",Business
Walmart lifts earnings outlook after revenues rise,Business
China's e-commerce giant Alibaba misses first-quarter revenue estimates,Business
Global shares trade higher after Wall Street rises and Japan GDP data show growth,Business
"In $36 billion deal, Mars to buy Pringles maker Kellanova",Business
"Core US inflation eases a fourth month, sealing Fed rate cut",Business
Starbucks gains $27 billion in a day on new ‘dream’ CEO,Business
"Starbucks up 25%, Chipotle down 7%: What a 'dream' CEO can do in a day",Business
Starbucks ousts CEO Laxman Narasimhan for Chipotle replacement,Business
"F1 spikes demand for travel to Singapore, Abu Dhabi, says travel company",Business
20Apple opens its first retail store in India,Business
9India's oldest billionaire Keshub Mahindra passes away at 99,Business
15FM Nirmala Sitharaman presents Budget 2023,Business
10Over 500 corporate bigwigs throng to watch Natasha Malpani Oswal's 'Uunchai' celebratory screening,Business
4In Pics: From Darkness to Limelight- The Story of Sandeep Kumar Mishra,Business
11In pics: Bollywood celebrities graced Businessman Hitesh Khushlani's b’day party in Dubai,Business
38:58Money Mantra Ep 5 | Labour Law Advisor founders Rishabh Jain and Mandeep Gill share their content creation journey,Business
38:58Money Mantra Ep 5 | Labour Law Advisor founders Rishabh Jain and Mandeep Gill share their content creation journey,Business
Dhan Ki Baat | Role of policy making in financial literacy,Business
19:03Money Mantra Ep 4 | How content creator Neha Nagar mixes finance education with entertainment,Business
22:29Dhan Ki Baat | Understanding how youth perceive financial literacy,Business
26:18Money Mantra Ep 3 | How Prakash Gaba started investing at the age of 47,Business
Dhan Ki Baat | Decoding the next decade of India’s stock market,Business
1.14 lakh startups generate more than 12 lakh jobs in India: Finance ministry,Business
These startups are helping carbon dioxide find a new life,Business
E-commerce firm Udaan raises $340 million ahead of planned IPO,Business
Minuscule AI startup raises $41 million to tap India growth,Business
ZestMoney set to shut operations this month,Business
Startups will play important role in helping India become 3rd largest economy: CEA Nageswaran,Business
E-Commerce startup Udaan to trim costs ahead of 2025 IPO,Business
Kerala-based startup bags prestigious awards,Business
Startup BharatAgri raises Rs 35 crore from investors,Business
Co-living startup Settl to enter Chennai market,Business
Agnikul raises Rs 200 crore in Series B funding,Business
Space sector start-up Sisir Radar to develop SAR on L/P band SAR,Business
From Ban to Black Market: India's Tobacco Challenge,Business
Wholesale inflation eases to 3.85% in February,Business
Fried acknowledges 'mistakes'; testifies he didn't defraud anyone,Business
Coinbase CEO Armstrong decries rumors of possible US SEC ban on crypto staking,Business
"Budget proposes 30% TDS on net winnings in online games, removes threshold for TDS levy",Business
The man saving the world from the next big crypto scam,Business
Bitcoin barrels toward historic January as crypto market jumps by $280 billion,Business
Bhavisha Homes: A Beacon of Excellence in Bangalore's Real Estate Landscape,Business
"Global foray an option under evaluation, leverage Rs 75k crore USOF for devices, services: Reliance Jio president Mathew Oommen",Business
Shattering records and cultivating future stars,Business
Air India Express to reveal new brand and expansion plans,Business
Yes Bank Corporate Financing,Business
Bank of Maharashtra Maha Gold Scheme,Business
Bank of Maharashtra Maha Super Car Loan Scheme,Business
Bank of Maharashtra MSME/Large Credit Schemes,Business
