Headline,Genre
Observation challenge: can you spot the missing number in 10 seconds or less?,Education
Optical illusion: Only the sharpest minds will succeed in this 10 second challenge,Education
Visual Brain Teaser: Can You Spot the Animals with Empty Glasses in this Photo?,Education
Bad at Math? Try These 8 Strategies to Crack the Quantitative Section of Any Exam,Education
9 Key differences between Indian Navy and Merchant Navy: Which pays better?,Education
8 skills that can make you the CEO of a company,Education
Words That Confuse: A Student's Guide to Avoiding Common Language Pitfalls,Education
8 secret mantras to beat stress at the workplace,Education
"From vibing to bussin', amp up your Gen Z vocabulary with these words",Education
9 proven tips that will help you improve your IELTS reading speed and score,Education
7 habits that will make you smarter and more successful,Education
Why do successful people start their day at 5 AM? 8 reasons for students to consider,Education
How to say 'I don't know' in a job interview: Here are 7 alternate phrases you can use,Education
10 Shakespeare quotes to motivate students,Education
Fostering Integrity: 10 Strategies to Instil Honesty in Students,Education
8 Easiest programming languages you can learn on your own,Education
8 Common job search mistakes you must avoid,Education
8 Warning Signs That You're Sabotaging Your Own Success,Education
10 science-backed tips to boost your performance and top the toughest exams,Education
Check 10 best colleges of DU according to NIRF 2024 rankings,Education
​10 Reasons Why Learning a Second Language at an Early Age Benefits Students​,Education
9 smart phrases that will make you stand out in class among peers,Education
Master Your Vocabulary: 8 Unique Words for Emotions You Can Feel But Can’t Describe,Education
​10 Surprising Habits of Toppers You Can Start Following From Today,Education
​10 Challenges Students Must Tackle Before Studying Abroad​,Education
Independence Day quiz for students: 5 quick questions about India's freedom movement,Education
9 ways you can maximise the benefits of online learning,Education
Top 9 institutes of Delhi across according to NIRF 2024,Education
Worried that AI might take your job? These 8 human skills will make you irreplaceable,Education
10 Reasons Why AI Data Science and Machine Learning Are Not the Same,Education
NIRF Rankings 2024: Top 7 Engineering Institutes in Delhi,Education
10 school field trips you shouldn't miss,Education
9 essential soft-skills top recruiters look for in candidates and how to inculcate them,Education
​10 Ways How Students Can Quickly Master a New Language​,Education
8 Expert-backed Tips to Build Effective Study Habits,Education
Independence Day speech: Simple yet impactful ideas for students,Education
Preparing for JEE from Class 10: X strategies for assured success,Education
8 Smart Tips for Identifying and Avoiding Online Part-Time Job Scams,Education
9 Insider Secrets to Secure Your Dream Job at Google,Education
​10 tricks to sharpen your classroom focus and boost engagement,Education
9 Important Documents Required for Student Visas,Education
Enhance Your Communication Skill: 10 Powerful Words Instead of Clichés,Education
10 Hidden Cognitive Skills Good Students Have Been Using All Along,Education
10 Effortless Strategies for Students to Enhance Their Public Speaking Skills,Education
Independence Day 2024: 8 thought-provoking essay ideas for students,Education
GK for Students: Do You Know the Scientific Names of These Common Plants?,Education
10 Fun and Productive Ways Students Can Make the Most of Their Weekends,Education
9 Reasons Why Not Knowing Your Mother Tongue Will Limit Your Career Growth,Education
10 Books on Indian Independence Struggle Every Student Must Read,Education
9 simple ways students can overcome laziness and increase productivity,Education
10 Energizing Morning Habits Every Student Needs for a Power-Packed Day,Education
Select a City,Health
"‘Stage 4 cancer but despite drugs and side effects, I live, work and d...",Health
‘Risk of Mpox outbreak low in India but we’re prepared’,Health
New tech that can significantly cut organ waiting list,Health
5 everyday morning habits to detox kidney and liver,Health
Oregano’s healthy wonders: Reasons to sprinkle your food with this herb,Health
Are you a genius? Spot the hidden cat in under 8 seconds!,Health
11 minutes of walking can unlock these 11 benefits,Health
8 health benefits of doing cat cow yoga pose,Health
Flavoured yoghurt to ketchup: Hidden sources of sugar and fat that are making you sick,Health
Poll of the day,Health
Other Group Sites,Health
Select a City,Health
Videos,Health
Is Your Relationship Falling Apart? These 5 Things Could Be ...,Health
Homeopathy Under The Microscope: Expert Busts Myths Around A...,Health
"Your Ticket Out of Karma: Bhagavad Gita, Chapter 4, Verse 11",Health
Tips to Manage Kids' Sweet Cravings for Better Health,Health
"Homecooked Meals Key to Brain Health, Experts Suggest",Health
6 variations of push-ups for hitting different body muscles,Health
"Late Dinners Linked to High Cholesterol Levels, Experts Warn",Health
Other Group Sites,Health
Oregano’s healthy wonders: Reasons to sprinkle your food with this herb,Health
Health benefits of consuming Omega-3 fatty acids,Health
5 herbs and spices to boost liver health,Health
8 health benefits of chia seeds to supercharge your diet,Health
"Soaked raisins vs soaked almonds, which is better for weight loss?",Health
What are elevenses? Why you must start following it in your diet plan,Health
Why is Vitamin B12 deficiency considered so dangerous,Health
From Avocado to Zinc: Key nutrients for healthy skin and how to get them,Health
Morning or evening: When to have coffee for maximum benefits,Health
Eating almonds with skin or without it: Which is healthier?,Health
Does keto diet raise cholesterol levels? Experts comment on new study's findings,Health
Plant-based diets: Are you ready to make the switch?,Health
,Health
Is it healthy to consume eggs everyday?,Health
Why consuming selenium is necessary to fix your thyroid,Health
,Health
Incorporating Sacha Inchi into Your Diet: Benefits of this healthy superfood,Health
Exploring Moringa Benefits: 6 reasons you must consume Moringa powder,Health
5 natural drinks that balance electrolytes in the body,Health
7 common cravings and the vitamin deficiencies they indicate,Health
Surprising benefits of pear you didn't know about,Health
How many walnuts a day are enough to keep the brain healthy?,Health
,Health
5 simple tips to handle your child’s sweet and sugar obsession,Health
5 powerful food combinations to boost your brain health,Health
"Diet, supplements and workout: A complete guide to control PCOS",Health
10 superfoods crucial for women post 30,Health
Sugar vs Salt: How much is too much?,Health
7 types of vegetarian diets and which is the best,Health
Walnuts vs almonds: Which is healthier?,Health
,Health
Smart Plating: How to dress your plate for each meal to stay fit and young,Health
Soaked peanuts vs soaked almonds; which is healthier for you?,Health
National Watermelon Day 2024: How much watermelon should you eat in a day?,Health
Vegan vs Mixed diet: Which is best for slow ageing?,Health
Fatty liver diet: Best and worst foods for your liver,Health
7 day diet plan to lose 2 kgs in a week,Health
Diet tips to reduce hair fall during monsoon,Health
,Health
How to eat rice and chapati to get maximum benefits,Health
How many almonds a day are enough for an adult (and the right way to eat them)?,Health
5 additional diet tips to boost production of vitamin B12,Health
"Not just reproductive health, 8 Shilajit health benefits you need to know",Health
Why is baasi roti the most nutritious breakfast to have?,Health
Drink a cup of almond tea every day for these amazing benefits,Health
6 best fruit juices to enhance intelligence,Health
7 ways to add fibre in your diet for better health,Health
,Health
7-day collagen-rich diet for clear and glowing skin,Health
Benefits of eating 6 soaked almonds every morning,Health
7 important supplements for maintaining best health,Health
Nutritionist reveals Katrina Kaif's unique diet which keeps her slim and toned,Health
8 nutrient-dense superfoods one must consume everyday,Health
Is drinking milk in the morning healthier than night?,Health
6 healthy snack replacements for evening hunger pangs,Health
,Health
Plant-based nutrition for weight management and sustained energy,Health
Are you a genius? Spot the hidden cat in under 8 seconds!,Health
Optical Illusion: Only the one with Eagle eyes can spot the odd apple in this picture,Health
Test Your IQ: Solve the Fruit Emoji Puzzle Challenge Now!,Health
Optical Illusion: Can you spot the odd bulb in 3 seconds?,Health
Optical illusion: Which building is closer to you?,Health
Optical Illusion: Can you find the odd word in this image?,Health
A brilliant mind according to psychology has these traits,Health
Optical Illusion: Challenge yourself and find 994 in this image,Health
What do moles on our legs signify? Read here,Health
"IQ Test: Only a genius can find the value of bag, pencil and notebook",Health
How excessive screen time affects mental health,Health
Optical Illusion: Can you spot 102 in this picture?,Health
,Health
Only a few have been able to identify four hidden soldiers in this picture; would you take up this challenge?,Health
Spot the conspiracy: Can your sharp eyes find the hidden message in this optical illusion?,Health
,Health
What do you see first? Optical illusion can reveal what people talk about you in a closed room,Health
Optical Illusion: You're a real puzzle ninja if you can spot 3 difference in this children picture,Health
8 simple psychology tricks to strengthen self-discipline,Health
IQ Test: You've a high IQ if you can guess the country's name,Health
7 daily habits that release happy hormones,Health
Vision test: Only a person with hawk eyes can spot the ring in under 6 seconds,Health
,Health
Optical Illusion: Only the one with the sharpest vision can spot the hidden glove,Health
Optical illusion: Only an animal lover can spot the Leopard in under 7 seconds,Health
Spot the Difference: Can you spot 3 differences in this gardening picture?,Health
Brain health and happiness: How nurturing our mind can lead to a joyful life,Health
Think you have a hawk’s eye? Find the hidden medals in this brain teaser,Health
​The most powerful morning routine and habits of successful people,Health
Personality Test: Discover your hidden personality traits through your eyebrow shape,Health
,Health
Personality test: Are you kind enough to find a heart among these elephants,Health
7 quirky habits of highly intelligent people,Health
Brain test: Only a person with high IQ can solve this puzzle,Health
Optical Illusion: Can you spot 580 in this image in under 10 seconds?,Health
How gadgets are fueling personality disorders in youth,Health
9 daily reminders to be a happy and stress-free person,Health
Personality Test: The shape of your forehead reveals your hidden traits,Health
,Health
Optical illusion: You have 20/20 vision if you can spot the hidden Frog in this room,Health
Optical illusion: Can you spot the right string attached to the Banana?,Health
Personality Test: The shape of your nail can reveal your hidden traits,Health
Personality Test: The size of your ears can uncover your hidden traits,Health
Test your brain: Only people with a young mind can spot the number '6',Health
Only those with sharp vision can spot the odd banana bunch in this picture,Health
Optical Illusion: Can you spot 690 in this image in under 5 seconds?,Health
Calm in the chaos: Balancing 9 to 5 with inner peace,Health
,Health
What do moles on different parts of the hand mean?,Health
"Optical Illusion: Squint or hold away your phone, what do you see?",Health
How Japanese principle Yutori can change your life,Health
Test your skills: Spot the 4 hidden archers in just 12 seconds!,Health
Personality Test: The way you cross your thumbs reveals your hidden qualities,Health
Hidden Owl in the jungle: Can you find it in 7 seconds?,Health
Do you have eagle eyes? Find 6 medals in 7 seconds,Health
,Health
"Recognizing lung cancer: Comprehensive guide on symptoms, diagnosis, treatment, and prevention",Health
Is COVID back? Data on India's COVID cases is alarming,Health
"Expert shares symptoms of the new COVID variants, FLiRT and LB.1",Health
"Think COVID is gone? WHO says coronavirus still kills 1,700 a week",Health
"KP.3, the new COVID variant is here: What we know about it till now",Health
FLiRT COVID variant cases cross 300 mark in India: Unusual COVID symptoms to know (not cough or cold),Health
"After Maharashtra, FLiRT variants identified in Kolkata: COVID symptoms to pay attention to",Health
COVID wave in Singapore: FLiRT variants in circulation,Health
Increase in heart attack deaths decoded? Read this,Health
COVID cases rise in Delhi: Symptoms and preventive measures one must be aware of,Health
China warns COVID-19 cases may rise during spring festival: Report,Health
"COVID update: 1,513 cases of JN.1 variant detected in India, says INSACOG",Health
COVID: Study says this technique can find new variants a week more quickly than traditional methods,Health
,Health
COVID JN.1 variant: How timely identification and intervention can help,Health
"​COVID infections may rebound in January, Chinese health authorities warn​",Health
,Health
​This COVID variant can infect the lower lungs and cause severe disease symptoms​,Health
"COVID is still a threat, says WHO",Health
"Is It COVID, flu, or a common cold; know the symptoms",Health
COVID variants circulating in Delhi,Health
Symptoms of COVID and the order in which they appear​,Health
COVID increases risk of schizophrenia?,Health
,Health
How COVID and steroids are afflicting the hips in young adults,Health
Many kids have COVID symptoms that stick around for a while,Health
High fat diets linked to increased risk of COVID,Health
COVID JN.1 variant cases rise: Two new symptoms detected,Health
COVID update: 16 cases of JN.1 variant in Delhi,Health
COVID: 157 JN.1 cases in India; Delhi's lone case recovers,Health
COVID JN.1 cases rise: Expert shares preventive measures,Health
,Health
AIIMS releases guidelines for COVID: Note the symptoms,Health
First case of COVID JN.1 variant found in Delhi: Report,Health
JN.1 variant COVID cases cross 100 mark,Health
COVID-19 JN.1 strain: Why you should take extreme precautions as cases rise,Health
Does JN.1 have the same symptoms as other COVID variants?,Health
"WHO calls COVID-19 strain JN.1 a ""variant of interest"" This is what it means",Health
​COVID JN.1 scare: Karnataka government makes mask mandatory for older people; other preventive measures to follow​,Health
,Health
​Infected by COVID-19 in the past 3 waves? Read this​,Health
"What is JN.1, the new COVID variant?",Health
Health agency warns of winter wave of COVID: All you need to know,Health
​Is COVID back? 10 recent developments to know​,Health
US FDA approves new COVID vaccine,Health
"Good news! New COVID-19 variant BA.2.86 may be less contagious and less immune-evasive than feared, lab tests find",Health
1 in 58 in the UK have COVID right now,Health
COVID Pirola spreads; symptoms to know,Health
,Health
New COVID strain called FL 1.5.1 detected,Health
"Which arm gets the COVID-19 booster shot may impact your immune response, study finds",Health
​COVID variant Eris symptoms you need to know,Health
"New COVID variant, BA.2.86, under WHO's 'variant under monitoring' list",Health
​Pre-COVID Eris variant symptoms​,Health
Main symptoms of the new COVID variant Eris,Health
WHO declares Eris a COVID variant of interest,Health
,Health
Is COVID variant Eris rising in Maharashtra?,Health
7 home remedies that can give you relief from summer season itchiness,Health
5 effective remedies to reduce uric acid levels,Health
Lingering cough and sneeze? These home remedies can help you,Health
"Glaucoma, most painful disease of the eye: 5 tips to manage it",Health
Natural remedies to keep blood sugar level at normal range,Health
5 home remedies to manage cough and cold,Health
Acidity: Easy Ayurvedic remedies that will give immediate relief,Health
Want rapid hair growth? Herbs you should try,Health
Home remedies for constipation in children,Health
How to whiten your teeth naturally,Health
Turmeric tea: A natural remedy for inflammation and joint pain,Health
How Ayurvedic herb Sadabahar can be used to manage diabetes,Health
,Health
3 powerful natural remedies to fix bloating by balancing gut bacteria,Health
How to do face yoga for double chin reduction,Health
,Health
THESE ayurvedic aphrodisiacs can naturally boost your sex drive,Health
Coronavirus: How to look after yourself at home if you get infected with XBB 1.16,Health
Ayurvedic home remedies to relieve constipation naturally,Health
Ayurvedic tips to strengthen your immunity this winter,Health
"Himalayan Gold: What is it, why is it called 'Himalayan Gold' and does it have any health benefits?",Health
Kerala's Pathimugham drink has several Ayurvedic benefits; details here,Health
,Health
"What Ayurveda says about how much sex you should have, as per seasons",Health
Ashwagandha: Health benefits of Indian Ginseng,Health
The interesting ways CBD can be used for pain relief,Health
Dengue cases on rise in India; these drinks may help fight the disease,Health
Sucking on ice cubes can help with sore throat? Home remedies to soothe sore throat,Health
Mulethi: How to use licorice for cold and sore throat,Health
Brain food: 5 ayurvedic remedies for strengthening memory,Health
,Health
How to use sound to heal yourself,Health
Health benefits of Ashwagandha (besides relieving stress),Health
At-home remedies to treat urinary tract infection (UTI) (without antibiotics),Health
Effective home remedies to combat Swine Flu infection,Health
Natural remedies to postpone periods,Health
Herbs which can do wonders to your immunity during monsoon,Health
Calm heartburn with these 10 easy home remedies,Health
,Health
Sadhguru reveals how honey can turn poisonous; here's the right way to consume it,Health
Side effect of Triphala: How to safely consume this Ayurvedic remedy,Health
7 best painkillers found in Indian kitchen,Health
"Easy to prepare, immunity-boosting tea recipes for all chai lovers",Health
Smell training: Essential oils that may help regain your sense of smell after a COVID-19 infection,Health
"Effective home remedies in your kitchen to treat cold, cough, flu at home",Health
World No Tobacco Day: Foods that may save smokers from lung diseases,Health
Five diseases best treated in homoeopathy,Health
,Health
Common reproductive health concerns in women; Turning to Ayurveda for solutions,Health
Thyroid disorder: Can Acupuncture help to balance the level of hormones?,Health
Ayurvedic expert shares if giloy can damage your liver (along with dos and don’ts),Health
"Giloy falsely linked to liver damage, it is safe in appropriate doses: Ayush",Health
5 natural mouth fresheners that can help to get rid of bad breath,Health
Reasons why you should cover your head in winters,Health
Ashwagandha: Why you should not take it when suffering from fever and what are the other side-effects,Health
,Health
"Massaging for immunity: How to do it, when to do it and the right type of oil to use",Health
5 reasons you’re not losing weight,Health
"68 year old Boney Kapoor sheds 14 kilos, aims for 8 more",Health
Weight Loss Story: This Bangalore man lost 20 kgs by regular walks in the neighbourhood,Health
Effortless weight loss: Secrets to lose weight while lying down,Health
Tadpole water for melting belly fat: How soaked chia seeds and lemon water can help you shed pounds,Health
How long should one diet to actually start losing weight,Health
Can walking damage knees? 5 facts all morning walkers should know,Health
"Unbelievable weight loss: World's heaviest man Khalid Shaari sheds 542 kg, now unrecognizable at 63 kg",Health
Must-try strength training exercises for maximum muscle growth,Health
5 herbs that can aid weight loss,Health
Weight Loss Story: This Kolkata girl had a transformational weight loss by quitting rice and roti,Health
6 home workouts to lose 3-4kg in a week,Health
,Health
How Mary Kom dropped 2 Kg in 4 Hours: Is quick weight loss possible?,Health
Child Obesity: Simple fitness routines that can keep your child fit,Health
,Health
How long does it take to lose weight?,Health
Power of Frog Pose: 6 incredible benefits of Mandukasana and how to do it right,Health
"Weight Loss Story: 10kg down, this woman’s life-changing fat to fit experience will motivate you",Health
Weight loss techniques to push through weight loss plateaus,Health
"Doing these 5 movements while walking tones muscles, promotes weight loss",Health
Weight loss made simple: 7 day simple exercise routine that works like magic,Health
,Health
10 Yoga poses and techniques to strengthen bones,Health
5 everyday healthy hacks for an impressive weight loss,Health
8 yoga poses to improve lung capacity and strengthen respiratory muscles,Health
"How to eat dry fruits for weight loss? (No, it's not just by soaking them)",Health
"Weight Loss Story: From XXL to S, this woman lost almost 30 Kgs without going to the gym",Health
Walking in morning vs walking in evening: Which is effective for weight loss?,Health
7 natural drinks that help with instant weight loss,Health
,Health
5 healthiest fats to begin your day with,Health
5 side effects of gond katira on health,Health
Intermittent fasting for weight loss? Here are some risks and benefits,Health
"Weight Loss Story: From rock bottom to fitness coach, this Bangalore woman lost 37 Kgs and defeated depression",Health
Understanding stages of weight loss (and where you are most likely to gain weight if you stop),Health
Early morning habits that help with quick and effective weight loss,Health
Intermittent fasting and lots of fluids: How R Madhavan lost weight in just 21 days,Health
,Health
7-day weight loss plan for those who have desk jobs,Health
5 morning drinks that melt belly fat and shrink the waist,Health
Weight Loss Story: This girl lost 17 kg in 12 months with THIS diet and workout routine,Health
6 ways ghee can help you lose weight,Health
Morning vs evening workout: Which is better for weight loss?,Health
How meditation can help in weight loss,Health
How to walk the right way to lose weight and get added benefits,Health
Same amount of exercise benefits women more than men: True or False?,Health
,Health
"Lose weight while sitting: Simple exercises for toning, muscle building",Health
How to lose weight by climbing stairs,Health
Weight Loss Story: This doctor shed 37 kgs by doing home workouts and eating clean,Health
7 low carbohydrate foods you must eat for weight loss,Health
6 resistance band workouts for muscle bulk up,Health
Neha Dhupia lost 23kgs: This is what she did differently,Health
5 yoga poses to fight stubborn belly fat,Health
,Health
Nutritionist shares 7 daily habits for quick belly fat loss,Health
6 yoga poses to reduce neck pain,Health
6 best yoga poses to get relief from arthritis pain,Health
"Knee Pain and Mental Health: How stress, anxiety, and chronic pain interact",Health
The digital revolution in active physiotherapy: How online treatment is transforming patient care,Health
What is palliative care and pain management in lung cancer?,Health
How important is Physiotherapy for stroke recovery ?,Health
5 workstation yoga exercises to increase blood flow and flexibility,Health
The essence of Yoga: Unveiling the power of asanas,Health
6 essential yoga asanas every woman should practice for a healthy life,Health
Yoga for stress management in a chaotic world,Health
How yoga practices and mindfulness can benefit males battling infertility,Health
TIPRA Motha chief meets Congress leaders as BJP eyes pact,Politics
"LS polls: 'Ahmed Patel's legacy won't go in vain,' Mumtaz says after Cong announces to give late father's seat to AAP",Politics
"Buzz over Navjot Singh Sidhu's return to BJP, Gurdaspur ticket for Yuvraj Singh",Politics
"Victory of voters: Sharad Pawar after Supreme Court ruling on his faction's name, symbol",Politics
"NCP row: Sharad faction can use 'NCP-Sharadchandra Pawar' name till further orders, SC says",Politics
"Congress ready to fight BJP, Election Commission over Assam Delimitation: Rakibul Hussain",Politics
"“Only supporters of ‘Tukde-Tukde’ gang can think of dividing, killing Bharat Mata,” Anurag Thakur",Politics
Stop useless acting and false anger: Shrinate to Irani,Politics
When RS Chairman Dhankar appealed to Mallikarjun Kharge to take care of his health,Politics
"Nishikant Dubey hits out at Rahul, Sonia Gandhi and I.N.D.I.A alliance",Politics
Opposition is underestimating the intelligence of the voters: PM Modi at NDA meet,Politics
TMC releases manifesto for Tripura assembly polls,Politics
Tripura polls: Mithun Chakraborty holds road show,Politics
Sanjay Raut: Government forgot Veer Savarkar,Politics
Who are Congress’s CM contenders in Himachal Pradesh,Politics
Karnataka polls: Rebel trouble haunts three major parties,Politics
"Shettar, Savadi exits could dent BJP’s Lingayat support in Karnataka polls",Politics
"Karnataka elections: Unruffled by revolts, BJP banks on 72 first-time candidates",Politics
Rahul Gandhi's disqualification 'immediate & automatic' despite bail: Legal experts,Politics
BJP to begin 'Mission 2024' for UP from January,Politics
